{
  "id": "dalur_soft_01",
  "version": 1,
  "name": "Soft",
  "description": "Airy low-contrast softness.",
  "creatorType": "dalur",
  "lut": {
    "format": "cube",
    "size": 17,
    "source": "bundled://luts/dalur_soft_01.cube",
    "hash": "3131df428b0136c5c72fd422890ceaaa40f2c1f7e2302d6cec87dce83a6d4f8a",
    "kind": "creative"
  },
  "intensity": 0.8,
  "tone": {
    "exposure": 0.04,
    "contrast": -0.12,
    "highlights": 0.04,
    "shadows": 0.08,
    "fade": 0.12
  },
  "color": {
    "temperature": 0.08,
    "tint": 0.01,
    "saturation": -0.05
  },
  "effects": {
    "grain": 0.1,
    "grainSize": 0.5,
    "halation": 0.05,
    "bloom": 0.1,
    "vignette": 0.02,
    "chromaticAberration": 0.005
  },
  "frame": {
    "enabled": false,
    "showDate": false
  }
}