{
  "id": "dalur_cinema_01",
  "version": 1,
  "name": "Cinema",
  "description": "Controlled cinematic teal-warm.",
  "creatorType": "dalur",
  "lut": {
    "format": "cube",
    "size": 17,
    "source": "bundled://luts/dalur_cinema_01.cube",
    "hash": "306880e4db9f2c9d5a15b0f968753ef1782a329bf3f41b03a433480fb23415a3",
    "kind": "creative"
  },
  "intensity": 0.9,
  "tone": {
    "exposure": 0.0,
    "contrast": 0.09,
    "highlights": -0.06,
    "shadows": -0.03,
    "fade": 0.02
  },
  "color": {
    "temperature": 0.04,
    "tint": -0.03,
    "saturation": 0.04
  },
  "effects": {
    "grain": 0.12,
    "grainSize": 0.5,
    "halation": 0.07,
    "bloom": 0.05,
    "vignette": 0.08,
    "chromaticAberration": 0.015
  },
  "frame": {
    "enabled": false,
    "showDate": false
  }
}