{
  "id": "dalur_summer_01",
  "version": 1,
  "name": "Summer",
  "description": "Sunlit warm vibrance.",
  "creatorType": "dalur",
  "lut": {
    "format": "cube",
    "size": 17,
    "source": "bundled://luts/dalur_summer_01.cube",
    "hash": "80bd397de1becdc24d65d022bf20ce44f3967577260b7919e34217183fb9b595",
    "kind": "creative"
  },
  "intensity": 0.85,
  "tone": {
    "exposure": 0.03,
    "contrast": 0.06,
    "highlights": -0.04,
    "shadows": 0.02,
    "fade": 0.0
  },
  "color": {
    "temperature": 0.18,
    "tint": 0.0,
    "saturation": 0.14
  },
  "effects": {
    "grain": 0.08,
    "grainSize": 0.5,
    "halation": 0.1,
    "bloom": 0.08,
    "vignette": 0.03,
    "chromaticAberration": 0.01
  },
  "frame": {
    "enabled": false,
    "showDate": false
  }
}