{
  "id": "dalur_night_01",
  "version": 1,
  "name": "Night",
  "description": "Deep nocturnal calm.",
  "creatorType": "dalur",
  "lut": {
    "format": "cube",
    "size": 17,
    "source": "bundled://luts/dalur_night_01.cube",
    "hash": "446009245eec227401b6613f376acb2c98ec02af35d0de5d35d65ec5ac34d638",
    "kind": "creative"
  },
  "intensity": 0.9,
  "tone": {
    "exposure": -0.04,
    "contrast": 0.1,
    "highlights": 0.0,
    "shadows": -0.06,
    "fade": 0.0
  },
  "color": {
    "temperature": -0.1,
    "tint": -0.02,
    "saturation": -0.08
  },
  "effects": {
    "grain": 0.2,
    "grainSize": 0.5,
    "halation": 0.06,
    "bloom": 0.05,
    "vignette": 0.1,
    "chromaticAberration": 0.02
  },
  "frame": {
    "enabled": false,
    "showDate": false
  }
}