{
  "id": "dalur_memory_01",
  "version": 1,
  "name": "Memory",
  "description": "Warm, soft everyday memory.",
  "creatorType": "dalur",
  "lut": {
    "format": "cube",
    "size": 17,
    "source": "bundled://luts/dalur_memory_01.cube",
    "hash": "7ecda36e15485e28db05c124a8dfcbe696e83e5baafc529fbdd6eed34da8b36e",
    "kind": "creative"
  },
  "intensity": 0.85,
  "tone": {
    "exposure": 0.0,
    "contrast": -0.05,
    "highlights": -0.05,
    "shadows": 0.06,
    "fade": 0.08
  },
  "color": {
    "temperature": 0.12,
    "tint": 0.02,
    "saturation": 0.05
  },
  "effects": {
    "grain": 0.15,
    "grainSize": 0.5,
    "halation": 0.08,
    "bloom": 0.06,
    "vignette": 0.05,
    "chromaticAberration": 0.01
  },
  "frame": {
    "enabled": false,
    "showDate": false
  }
}