{
  "id": "dalur_mono_01",
  "version": 1,
  "name": "Mono",
  "description": "Quiet black and white.",
  "creatorType": "dalur",
  "lut": {
    "format": "cube",
    "size": 17,
    "source": "bundled://luts/dalur_mono_01.cube",
    "hash": "bd044d017802ab96345f439d93cd6c5b4efd1018a2be1c85027b83fef5ee5113",
    "kind": "creative"
  },
  "intensity": 1.0,
  "tone": {
    "exposure": 0.0,
    "contrast": 0.06,
    "highlights": -0.02,
    "shadows": 0.02,
    "fade": 0.03
  },
  "color": {
    "temperature": 0.0,
    "tint": 0.0,
    "saturation": -1.0
  },
  "effects": {
    "grain": 0.18,
    "grainSize": 0.5,
    "halation": 0.03,
    "bloom": 0.03,
    "vignette": 0.07,
    "chromaticAberration": 0.0
  },
  "frame": {
    "enabled": false,
    "showDate": false
  }
}